,proper_date,permit_date,owner_name,combined_address,contractor_name,type_of_work,int_sq_feet,int_valuation,currency_valuation,ApplicationPermitNumber,CommercialorResidential,TypeofWork,SiteNumber,SiteStreet,SiteStreetType,SiteStreetDirectional,SiteZip,Lot,Block,Subdivision,TotalSquareFeet,PlanCheckValuation,OwnerName,ContractorName,IssueDate,NumberOfUnits
0,2022-11-10,"Nov 10, 2022",Laura Stamatkin ,701 Central Ave. NE,"Pacificap Construction, LLC, Design Plus Llc",,5038,450000.0,"$450,000.00",BP-2021-48452,Commercial,a foundation,701,CENTRAL,AV,NE,,12,44,HUNINGS HIGHLAND ADDN,5038,450000,LAURA STAMATKIN - CU116839229,"PACIFICAP CONSTRUCTION, LLC, DESIGN PLUS LLC",20221110,
1,2022-11-10,"Nov 10, 2022",Treveston Elliott ,8510 Montgomery Blvd. NE,"Aic General Contractors Inc., Treveston Elliott Architect",,2508,90000.0,"$90,000.00",BP-2022-42707,Commercial,alterations,8510,MONTGOMERY,BLVD,NE,,2,0000,MONTGOMERY CROSSING ADDN PHASE 2,2508,90000,TREVESTON ELLIOTT - CU70987967,"AIC GENERAL CONTRACTORS, INC., TREVESTON ELLIOTT ARCHITECT",20221110,
2,2022-11-10,"Nov 10, 2022",Jessica Veit ,5650 University Blvd. SE,"Wilger Enterprises Inc., Dekker Perich Sabatini",,4405,201000.0,"$201,000.00",BP-2022-43447,Commercial,alterations,5650,UNIVERSITY,BLVD,SE,,26,0000,MESA DEL SOL INNOVATION PARK,4405,201000,JESSICA VEIT - CU68728436,"WILGER ENTERPRISES INC, DEKKER PERICH SABATINI",20221110,1
3,2022-11-10,"Nov 10, 2022",Christopher Beccone ,1713 Juan Tabo Blvd. NE,"Grancor Enterprises Inc., Studio Beccone A+D",,3535,80000.0,"$80,000.00",BP-2022-30588,Commercial,alterations,1713,JUAN TABO,BLVD,NE,,3B1,75,EASTRIDGE PLAZA ADDN,3535,80000,CHRISTOPHER BECCONE - CU45723264,"GRANCOR ENTERPRISES INC., STUDIO BECCONE A+D",20221110,1
4,2022-11-10,"Nov 10, 2022",Graham Hogan ,6001 Osuna Road NE,"Aic General Contractors Inc., Studiogp Llc",,3424,64707.0,"$64,707.00",BP-2022-39336,Commercial,a change of use project,6001,OSUNA,RD,NE,,B,0000,RHODES ACRES,3424,64707,GRAHAM HOGAN - CU66999504,"AIC GENERAL CONTRACTORS, INC., STUDIOGP LLC",20221110,
5,2022-11-10,"Nov 10, 2022",Serge  Kalajdzic ,4640 Jefferson St. NE,"Aic General Contractors Inc., The Hartman & Majewski Design Group",,1100,200000.0,"$200,000.00",BP-2022-42322,Commercial,an addition,4640,JEFFERSON,ST,NE,,2A2A,0000,JEFFERSON OFFICE PLAZA,1100,200000,SERGE  KALAJDZIC - CU31562498,"AIC GENERAL CONTRACTORS, INC., THE HARTMAN & MAJEWSKI DESIGN GROUP",20221110,
6,2022-11-09,"Nov 09, 2022",Brandon Webb ,2800 Coors Blvd. NW,Scheiner Commercial Group Inc.,,1624,105560.0,"$105,560.00",BP-2022-27422,Commercial,alterations,2800,COORS,BLVD,NW,,3,0000,WEST BLUFF CENTER,1624,105560,BRANDON WEBB - CU100293792,"SCHEINER COMMERCIAL GROUP, INC.",20221109,2
7,2022-11-09,"Nov 09, 2022",Delia Barrett ,1909 Bellamah Ave. NW,"Insight Construction, LLC",,606,0.0,,BP-2022-16456,Commercial,commercial renovation phase,1909,BELLAMAH,AV,NW,,340A2A1C,0000,MRGCD MAP 35,606,0,DELIA BARRETT - CU33336253,"INSIGHT CONSTRUCTION, LLC",20221109,
8,2022-11-09,"Nov 09, 2022",Daniel Branch ,1000 Rio Grande Blvd. NW,"Nexius Solutions Inc., Crown Castle",,10,40000.0,"$40,000.00",BP-2022-31788,Commercial,alterations,1000,RIO GRANDE,BLVD,NW,,338B2,0000,MRGCD MAP 35,10,40000,DANIEL BRANCH - CU48845897,"NEXIUS SOLUTIONS, INC., CROWN CASTLE",20221109,
9,2022-11-09,"Nov 09, 2022",Formative Architecture ,1909 Bellamah Ave. NW,"Insight Construction, LLC, Formative Architecture",,28065,175000.0,"$175,000.00",BP-2022-39658,Commercial,alterations,1909,BELLAMAH,AV,NW,,340A2A1C,0000,MRGCD MAP 35,28065,175000,FORMATIVE ARCHITECTURE - CU42313490,"INSIGHT CONSTRUCTION, LLC, FORMATIVE ARCHITECTURE",20221109,1
10,2022-11-09,"Nov 09, 2022",Daniel Branch ,1613 University Blvd. NE,"Nexius Solutions Inc., Crown Castle",,10,45000.0,"$45,000.00",BP-2022-35045,Commercial,alterations,1613,UNIVERSITY,BLVD,NE,,A,0000,SURGICAL ASSOC PA PROFIT SHARING PLAN & TRUST,10,45000,DANIEL BRANCH - CU48845897,"NEXIUS SOLUTIONS, INC., CROWN CASTLE",20221109,
11,2022-11-09,"Nov 09, 2022",Delia Barrett ,1909 Bellamah Ave. NW,"Insight Construction, LLC, Studio Southwest Architects",,3870,580500.0,"$580,500.00",BP-2022-05047,Commercial,alterations,1909,BELLAMAH,AV,NW,,340A2A1C,0000,MRGCD MAP 35,3870,580500,DELIA BARRETT - CU33336253,"INSIGHT CONSTRUCTION, LLC, STUDIO SOUTHWEST ARCHITECTS",20221109,
12,2022-11-09,"Nov 09, 2022",Daniel Branch ,1232 Juan Tabo Blvd. NE,"Nexius Solutions Inc., Crown Castle",,10,45000.0,"$45,000.00",BP-2022-33595,Commercial,alterations,1232,JUAN TABO,BLVD,NE,,3,3,ROYAL HEIGHTS,10,45000,DANIEL BRANCH - CU48845897,"NEXIUS SOLUTIONS, INC., CROWN CASTLE",20221109,
13,2022-11-09,"Nov 09, 2022",Daniel Branch ,3001 San Pedro  NE,"Nexius Solutions Inc., Crown Castle",,0,45000.0,"$45,000.00",BP-2022-33607,Commercial,alterations,3001,SAN PEDRO,DR,NE,,21,1,KIVA ADDN,0,45000,DANIEL BRANCH - CU48845897,"NEXIUS SOLUTIONS, INC., CROWN CASTLE",20221109,
14,2022-11-09,"Nov 09, 2022",Daniel Branch ,1605 Indian School Road NW,"Nexius Solutions Inc., Crown Castle",,10,40000.0,"$40,000.00",BP-2022-31765,Commercial,alterations,1605,INDIAN SCHOOL,RD,NW,,A1,5,GLENWAY PARK ADDN,10,40000,DANIEL BRANCH - CU48845897,"NEXIUS SOLUTIONS, INC., CROWN CASTLE",20221109,
15,2022-11-09,"Nov 09, 2022",Daniel Branch ,5700 Winter Haven Road NW,"Nexius Solutions Inc., Crown Castle",,10,45000.0,"$45,000.00",BP-2022-37847,Commercial,alterations,5700,WINTER HAVEN,RD,NW,,A1,0000,ALBUQUERQUE CHRISTIAN CHILDRENS HOME,10,45000,DANIEL BRANCH - CU48845897,"NEXIUS SOLUTIONS, INC., CROWN CASTLE",20221109,
16,2022-11-08,"Nov 08, 2022",Wilsons Athletic Center,12500 Comanche Road NE,Electrical Products Co.,,0,2000.0,"$2,000.00",GP-2022-14506,Commercial,a commercial sign,12500,COMANCHE,RD,NE,,A,0000,TINNIN--R P,0,2000,WILSONS ATHLETIC CENTER,ELECTRICAL PRODUCTS COMPANY,20221108,0
17,2022-11-08,"Nov 08, 2022",Cake Fetish,2677 Louisiana Blvd. NE,Electrical Products Co.,,0,1500.0,"$1,500.00",GP-2022-32756,Commercial,a commercial sign,2677,LOUISIANA,BLVD,NE,,13-19,8,VISTA ENCANTADA,0,1500,CAKE FETISH,ELECTRICAL PRODUCTS COMPANY,20221108,0
18,2022-11-08,"Nov 08, 2022",Xfinity Cottonwood,3400 Nm 528  NW,Electrical Products Co.,,0,1800.0,"$1,800.00",GP-2022-36035,Commercial,a commercial sign,3400,NM 528,,NW,,3, ,LOWES,0,1800,XFINITY COTTONWOOD,ELECTRICAL PRODUCTS COMPANY,20221108,0
19,2022-11-08,"Nov 08, 2022",Mario'S Pizzeria,5700 4Th St. NW,Electrical Products Co.,,0,1800.0,"$1,800.00",GP-2022-42201,Commercial,a commercial sign,5700,4TH,ST,NW,,A,0000,HARPER ADDN,0,1800,MARIO'S PIZZERIA,ELECTRICAL PRODUCTS COMPANY,20221108,0
20,2022-11-07,"Nov 07, 2022",Derek Metson ,5201 Hawking  SE,"Cordova Contracting & Development, LLC",,30000,1180000.0,"$1,180,000.00",BP-2022-34221,Commercial,a foundation,5201,HAWKING,DR,SE,,D3,0000,MESA DEL SOL INNOVATION PARK II,30000,1180000,DEREK METSON - CU162303441,"CORDOVA CONTRACTING & DEVELOPMENT, LLC",20221107,2
21,2022-11-07,"Nov 07, 2022",Christopher Santacroce ,5650 University Blvd. SE,"Dekker Perich Sabatini, Jtm Construction Group Inc.",,129870,10760000.0,"$10,760,000.00",BP-2022-34364,Commercial,shell building,5650,UNIVERSITY,BLVD,SE,,26,0000,MESA DEL SOL INNOVATION PARK,129870,10760000,CHRISTOPHER SANTACROCE - CU45220585,"DEKKER PERICH SABATINI, JTM CONSTRUCTION GROUP INC",20221107,
22,2022-11-07,"Nov 07, 2022",Derek Metson ,5201 Hawking  SE,"Cordova Contracting & Development, LLC",,21900,0.0,,BP-2022-35999,Commercial,commercial renovation phase,5201,HAWKING,DR,SE,,D,0000,MESA DEL SOL INNOVATION PARK II,21900,0,DEREK METSON - CU162303441,"CORDOVA CONTRACTING & DEVELOPMENT, LLC",20221107,
23,2022-11-07,"Nov 07, 2022",Craig Calvert ,5001 Montgomery Blvd. NE,"Hart Design And Construction Inc., Modulus Architects Inc.",,42298,350000.0,"$350,000.00",BP-2022-36578,Commercial,alterations,5001,MONTGOMERY,BLVD,NE,,D1A,0000,MONTGOMERY PLAZA,42298,350000,CRAIG CALVERT - CU43027250,"HART DESIGN AND CONSTRUCTION INC., MODULUS ARCHITECTS, INC",20221107,1
