,proper_date,permit_date,owner_name,combined_address,contractor_name,type_of_work,int_sq_feet,int_valuation,currency_valuation,ApplicationPermitNumber,CommercialorResidential,TypeofWork,SiteNumber,SiteStreet,SiteStreetType,SiteStreetDirectional,SiteZip,Lot,Block,Subdivision,TotalSquareFeet,PlanCheckValuation,OwnerName,ContractorName,IssueDate,NumberOfUnits
0,2024-10-11,"Oct 11, 2024",Jane Swallows ,10200 Acoma Road SE,"Varsity Llc, J5 Infrastructure Partners",,1064,20000.0,"$20,000.00",BP-2024-26330,Commercial,alterations,10200,ACOMA,RD,SE,,10A,38,SKYLINE HEIGHTS,1064,20000,JANE SWALLOWS - CU94536665,"VARSITY LLC, J5 INFRASTRUCTURE PARTNERS",20241011,
1,2024-10-10,"Oct 10, 2024",Jeremy Zak,5201 Hawking  SE,"Klinger Constructors Llc, Studio Southwest Architects",,0,46000.0,"$46,000.00",GP-2024-24720,Commercial,a site wall,5201,HAWKING,DR,SE,,D,0000,MESA DEL SOL INNOVATION PARK II,0,46000,JEREMY ZAK,"KLINGER CONSTRUCTORS LLC, STUDIO SOUTHWEST ARCHITECTS",20241010,0
2,2024-10-10,"Oct 10, 2024",Eric Munn ,4915 Lomas Blvd. NE,"Ti Design Services, Alliance Paving Inc.",,547,457600.0,"$457,600.00",BP-2024-20548,Commercial,a new building,4915,LOMAS,BLVD,NE,,3,4,PUEBLO ALTO ADDN,547,457600,ERIC MUNN - CU61763760,"TI DESIGN SERVICES, ALLIANCE PAVING, INC",20241010,1
3,2024-10-09,"Oct 09, 2024",Mcdonalds ,99999 Universe Blvd. NW,Electrical Products Co. Of Nm/ Zeon Signs,,0,2300.0,"$2,300.00",GP-2023-45872,Commercial,a commercial sign,99999,UNIVERSE,BLVD,NW,,H10,0000,VENTANA SQUARE AT VENTANA RANCH,0,2300,MCDONALDS ,ELECTRICAL PRODUCTS COMPANY OF NM/ ZEON SIGNS,20241009,0
4,2024-10-09,"Oct 09, 2024",Craig Calvert ,2100 Louisiana Blvd. NE,"Insight Construction, Llc, Modulus Architects Inc.",,6034,613089.13,"$613,089.13",BP-2024-23026,Commercial,shell building,2100,LOUISIANA,BLVD,NE,,D,0000,WINROCK CENTER ADDN,6034,613089.13,CRAIG CALVERT - CU43027250,"INSIGHT CONSTRUCTION, LLC, MODULUS ARCHITECTS, INC",20241009,
5,2024-10-08,"Oct 08, 2024",Jane Swallows ,3206 Alta Monte Ave. NE,"Enertech Resources, LLC, J5 Infrastructure Partners",,350,20000.0,"$20,000.00",BP-2024-33232,Commercial,commercial renovation phase,3206,ALTA MONTE,AV,NE,,A3A1A1,0000,CANDELARIA BUSINESS CENTER,350,20000,JANE SWALLOWS - CU94536665,"ENERTECH RESOURCES, LLC, J5 INFRASTRUCTURE PARTNERS",20241008,
6,2024-10-07,"Oct 07, 2024",Carlos  Torres ,5650 University Blvd. SE,"Wilger Enterprises Inc., Modulus Architects Inc.",,52425,4077616.5,"$4,077,616.50",BP-2024-13062,Commercial,a new building,5650,UNIVERSITY,BLVD,SE,,26,0000,MESA DEL SOL INNOVATION PARK,52425,4077616.5,CARLOS  TORRES - CU66674539,"WILGER ENTERPRISES INC, MODULUS ARCHITECTS, INC",20241007,1
7,2024-10-07,"Oct 07, 2024",Craig Calvert ,5001 Montgomery Blvd. NE,"Hart Design And Construction Inc., Modulus Architects Inc.",,15409,134000.0,"$134,000.00",BP-2024-32949,Commercial,alterations,5001,MONTGOMERY,BLVD,NE,,D1A,0000,MONTGOMERY PLAZA,15409,134000,CRAIG CALVERT - CU43027250,"HART DESIGN AND CONSTRUCTION INC., MODULUS ARCHITECTS, INC",20241007,1
