,proper_date,permit_date,owner_name,combined_address,contractor_name,type_of_work,int_sq_feet,int_valuation,currency_valuation,ApplicationPermitNumber,CommercialorResidential,TypeofWork,SiteNumber,SiteStreet,SiteStreetType,SiteStreetDirectional,SiteZip,Lot,Block,Subdivision,TotalSquareFeet,PlanCheckValuation,OwnerName,ContractorName,IssueDate,NumberOfUnits
0,2021-09-03,"September 03, 2021",Delia Barrett - Cu33336253,1001 Indian School Road NW,"Hart Design And Construction Inc., Studio Southwest Architects",Alterations,5500,750000.0,"$750,000.00",BP-2021-23701,Commercial,Alterations,1001,INDIAN SCHOOL,RD,NW,,84E,0000,MRGCD MAP 35,5500,750000,DELIA BARRETT - CU33336253,"HART DESIGN AND CONSTRUCTION INC., STUDIO SOUTHWEST ARCHITECTS",20210903,
1,2021-09-03,"September 03, 2021",Carlos  Torres - Cu66674539,5200 Menaul Blvd. NE,"Xpress Construction And Services Llc, Modulus Architects Inc.",Alterations,1880,795450.0,"$795,450.00",BP-2021-25150,Commercial,Alterations,5200,MENAUL,BLVD,NE,,4A1,108,BEL-AIR,1880,795450,CARLOS  TORRES - CU66674539,"XPRESS CONSTRUCTION AND SERVICES LLC, MODULUS ARCHITECTS, INC",20210903,
2,2021-09-03,"September 03, 2021",Dennis Caswell - Cu86107473,6200 Uptown Blvd. NE,Dpc Construction Ltd. Co.,Alterations,2999,50000.0,"$50,000.00",BP-2021-24699,Commercial,Alterations,6200,UPTOWN,BLVD,NE,,2B3,0000,BELLAMAH OFFICE ADDN,2999,50000,DENNIS CASWELL - CU86107473,DPC CONSTRUCTION LTD. CO.,20210903,
3,2021-09-03,"September 03, 2021",Regina Okoye - Cu114172906,7509 Menaul Blvd. NE,"7B Building & Development Llc, Modulus Architects Inc.",New Building,3486,1000000.0,"$1,000,000.00",BP-2021-17219,Commercial,New Building,7509,MENAUL,BLVD,NE,,3,8,BROAD ACRES ADDN,3486,1000000,REGINA OKOYE - CU114172906,"7B BUILDING & DEVELOPMENT LLC, MODULUS ARCHITECTS, INC",20210903,
4,2021-09-03,"September 03, 2021",Carlos  Torres - Cu66674539,5200 Menaul Blvd. NE,"Xpress Construction And Services Llc, Modulus Architects Inc.",Alterations,843,0.0,,BP-2021-26318,Commercial,Alterations,5200,MENAUL,BLVD,NE,,4A1,108,BEL-AIR,843,0,CARLOS  TORRES - CU66674539,"XPRESS CONSTRUCTION AND SERVICES LLC, MODULUS ARCHITECTS, INC",20210903,
5,2021-09-03,"September 03, 2021",Robert  Quintana - Cu61751232,2100 Louisiana Blvd. NE,"Hart Design And Construction Inc., Robert Quintana, Aia",Alterations,1499,85000.0,"$85,000.00",BP-2021-28146,Commercial,Alterations,2100,LOUISIANA,BLVD,NE,,A,0000,WINROCK CENTER ADDN,1499,85000,ROBERT  QUINTANA - CU61751232,"HART DESIGN AND CONSTRUCTION INC., ROBERT QUINTANA, AIA",20210903,
6,2021-09-03,"September 03, 2021",Wendell Montgomery - Cu115962870,3400 Nm 528  NW,Modulus Design Llc,Alterations,2375,150000.0,"$150,000.00",BP-2021-29144,Commercial,Alterations,3400,NM 528,,NW,,3, ,LOWES,2375,150000,WENDELL MONTGOMERY - CU115962870,MODULUS DESIGN LLC,20210903,
7,2021-09-03,"September 03, 2021","Thomas Cooley, Ph.D",6001 Winter Haven Road NW,Alan White Signs Llc,Sign - Commercial Sign,0,0.0,,GP-2021-33701,Commercial,Sign - Commercial Sign,6001,WINTER HAVEN,RD,NW,,5A1B1B,0000,TAYLOR--JOEL P,0,0,"THOMAS COOLEY, PH.D",ALAN WHITE SIGNS LLC,20210903,0
8,2021-09-02,"September 02, 2021",Doug Heller - Cu76280795,3715 Silver Ave. SE,"Insight Construction, LLC, Mullen Heller Architecture",Alterations,20490,800000.0,"$800,000.00",BP-2021-27040,Commercial,Alterations,3715,SILVER,AV,SE,,11,2,MANKATO PLACE,20490,800000,DOUG HELLER - CU76280795,"INSIGHT CONSTRUCTION, LLC, MULLEN HELLER ARCHITECTURE",20210902,
9,2021-09-02,"September 02, 2021",Marti Macdonald - Cu52801347,412 4Th St. NW,Paradise Power Company Inc.,City Project,9,63489.0,"$63,489.00",BP-2021-36851,Commercial,City Project,412,4TH,ST,NW,,24A,E,MANDELLS BUSINESS & RESIDENCE ADDN,9,63489,MARTI MACDONALD - CU52801347,PARADISE POWER COMPANY INC,20210902,
10,2021-09-02,"September 02, 2021",Minnie  Harrison - Cu104286733,10200 Bell Ave. SE,"Henderson, Jack B. Construction Co. Inc.",New Building,26372,1739000.0,"$1,739,000.00",BP-2021-02594,Commercial,New Building,10200,BELL,AV,SE,,10,46,SKYLINE HEIGHTS,26372,1739000,MINNIE  HARRISON - CU104286733,"HENDERSON, JACK B. CONSTRUCTION CO. INC.",20210902,
11,2021-09-02,"September 02, 2021",L E Riley - Cu122831887,4101 Central Ave. NE,"Alliance Residential Builders, LLC.",Addition,9040,127000.0,"$127,000.00",BP-2021-24182,Commercial,Addition,4101,CENTRAL,AV,NE,,6,2,MESA GRANDE ADDN,9040,127000,L E RILEY - CU122831887,"ALLIANCE RESIDENTIAL BUILDERS, LLC.",20210902,
12,2021-09-02,"September 02, 2021",Richard Cline - Cu35197847,6501 Americas  NE,"Dpc Construction Ltd. Co., Arcline Architectural Design",Alterations,1447,70000.0,"$70,000.00",BP-2021-28105,Commercial,Alterations,6501,AMERICAS,PKWY,NE,,1B1,0000,PARK SQUARE ADDN,1447,70000,RICHARD CLINE - CU35197847,"DPC CONSTRUCTION LTD. CO., ARCLINE ARCHITECTURAL DESIGN",20210902,
13,2021-09-02,"September 02, 2021",James Lewis - Cu34935835,5203 Juan Tabo Blvd. NE,"Sierra Development Co., James C Lewis Architect ",Alterations,2166,110040.0,"$110,040.00",BP-2021-34302,Commercial,Alterations,5203,JUAN TABO,BLVD,NE,,D3,0000,ACADEMY PLACE,2166,110040,JAMES LEWIS - CU34935835,"SIERRA DEVELOPMENT COMPANY, JAMES C LEWIS ARCHITECT ",20210902,
14,2021-09-02,"September 02, 2021",John Paul Mares - Cu31527681,3801 University Blvd. SE,Enterprise Builders Corp.,Alterations,24724,1066667.0,"$1,066,667.00",BP-2021-35347,Commercial,Alterations,3801,UNIVERSITY,BLVD,SE,,B,0000,UNM LANDS OF,24724,1066667,JOHN PAUL MARES - CU31527681,ENTERPRISE BUILDERS CORPORATION,20210902,
15,2021-09-01,"September 01, 2021",Formative Architecture - Cu42313490,1410 Central Ave. SW,"Aic General Contractors Inc., Formative Architecture",Alterations,14284,125000.0,"$125,000.00",BP-2021-35522,Commercial,Alterations,1410,CENTRAL,AV,SW,,349A,0000,MRGCD MAP 38,14284,125000,FORMATIVE ARCHITECTURE - CU42313490,"AIC GENERAL CONTRACTORS, INC., FORMATIVE ARCHITECTURE",20210901,1
16,2021-09-01,"September 01, 2021",Martin Grummer - Cu23278024,99999 Fineland  NW,"Wilger Enterprises Inc., Martin Grummer Architect",Shell Building,2513,100000.0,"$100,000.00",BP-2021-31596,Commercial,Shell Building,99999,FINELAND,DR,NW,,9A,0000,MCMAHON MARKETPLACE,2513,100000,MARTIN GRUMMER - CU23278024,"WILGER ENTERPRISES INC, MARTIN GRUMMER ARCHITECT",20210901,
17,2021-08-31,"August 31, 2021",Stephanie  Lucero - Cu85176400,99999 University Blvd. SE,Rachel Matthew Development Corp.,New Building,9995,0.0,,BP-2020-54001,Commercial,New Building,99999,UNIVERSITY,BLVD,SE,,5,0000,MESA DEL SOL,9995,0,STEPHANIE  LUCERO - CU85176400,RACHEL MATTHEW DEVELOPMENT CORPORATION,20210831,
18,2021-08-31,"August 31, 2021",Sam Chow - Cu139248069,518 Airport  NW,"Asa Carlton Inc., Mcg Architecture",Alterations,4833,158923.0,"$158,923.00",BP-2021-29826,Commercial,Alterations,518,AIRPORT,DR,NW,,2B1,0000,ATRISCO BUSINESS PARK UNIT 2 TRACT A,4833,158923,SAM CHOW - CU139248069,"ASA CARLTON INC, MCG ARCHITECTURE",20210831,1
19,2021-08-31,"August 31, 2021",M & M Company,4315 Wyoming Blvd. NE,Guzman Construction Solutions Llc,Demolition - Demolition,0,0.0,,GP-2021-38028,Commercial,Demolition - Demolition,4315,WYOMING,BLVD,NE,,1A,0000,LA MIRADA,0,0,M & M COMPANY,GUZMAN CONSTRUCTION SOLUTIONS LLC,20210831,0
20,2021-08-31,"August 31, 2021",Christopher Beccone - Cu45723264,4700 San Mateo Blvd. NE,"Sdv Construction Inc., Studio Beccone A+D",Alterations,20892,550000.0,"$550,000.00",BP-2021-29768,Commercial,Alterations,4700,SAN MATEO,BLVD,NE,,J,0000,BANKERS UNION LIFE,20892,550000,CHRISTOPHER BECCONE - CU45723264,"SDV CONSTRUCTION, INC., STUDIO BECCONE A+D",20210831,
21,2021-08-31,"August 31, 2021",Stephanie  Lucero - Cu85176400,99999 University Blvd. SE,Rachel Matthew Development Corp.,New Building,5728,0.0,,BP-2020-54011,Commercial,New Building,99999,UNIVERSITY,BLVD,SE,,5,0000,MESA DEL SOL,5728,0,STEPHANIE  LUCERO - CU85176400,RACHEL MATTHEW DEVELOPMENT CORPORATION,20210831,
22,2021-08-31,"August 31, 2021",Vanessa Funston - Cu118626721,6621 Gulton Ct. NE,Aic General Contractors Inc.,Change of Use,4476,140000.0,"$140,000.00",BP-2021-30221,Commercial,Change of Use,6621,GULTON,CT,NE,,3A1C,A,INTERSTATE INDUSTRIAL TRACT UNIT 2,4476,140000,VANESSA FUNSTON - CU118626721,"AIC GENERAL CONTRACTORS, INC.",20210831,
23,2021-08-31,"August 31, 2021",Taylor Hall - Cu65410890,6221 Riverside Plaza  NW,"Barnsley Construction, Llc, Pm Design Group Inc.",Alterations,3898,305000.0,"$305,000.00",BP-2021-33397,Commercial,Alterations,6221,RIVERSIDE PLAZA,LA,NW,,1A2A,0000,RIVERSIDE PLAZA,3898,305000,TAYLOR HALL - CU65410890,"BARNSLEY CONSTRUCTION, LLC, PM DESIGN GROUP, INC.",20210831,
24,2021-08-31,"August 31, 2021",Stephanie  Lucero - Cu85176400,99999 University Blvd. SE,Rachel Matthew Development Corp.,New Building,47000,5000000.0,"$5,000,000.00",BP-2020-51419,Commercial,New Building,99999,UNIVERSITY,BLVD,SE,,A1A5,0000,MESA DEL SOL INNOVATION PARK,47000,5000000,STEPHANIE  LUCERO - CU85176400,RACHEL MATTHEW DEVELOPMENT CORPORATION,20210831,
25,2021-08-31,"August 31, 2021",Stephanie  Lucero - Cu85176400,99999 Universe Blvd. NW,Rachel Matthew Development Corp.,Alterations,10410,0.0,,BP-2020-53791,Commercial,Alterations,99999,UNIVERSE,BLVD,NW,,B,0000,ANCIENT MESA,10410,0,STEPHANIE  LUCERO - CU85176400,RACHEL MATTHEW DEVELOPMENT CORPORATION,20210831,
26,2021-08-31,"August 31, 2021",Stephanie  Lucero - Cu85176400,99999 Universe Blvd. NW,Rachel Matthew Development Corp.,New Building,9595,0.0,,BP-2020-53993,Commercial,New Building,99999,UNIVERSE,BLVD,NW,,B,0000,ANCIENT MESA,9595,0,STEPHANIE  LUCERO - CU85176400,RACHEL MATTHEW DEVELOPMENT CORPORATION,20210831,
27,2021-08-31,"August 31, 2021",Don Dudley - Cu30605731,5505 Osuna Road NE,"Las Ventanas Construction Llc, G. Donald Dudley Architect, Ltd.",Alterations,1099,60000.0,"$60,000.00",BP-2021-29868,Commercial,Alterations,5505,OSUNA,RD,NE,,E2,0000,NORTH ACADEMY BUSINESS PARK,1099,60000,DON DUDLEY - CU30605731,"LAS VENTANAS CONSTRUCTION LLC, G. DONALD DUDLEY ARCHITECT, LTD.",20210831,1
28,2021-08-31,"August 31, 2021",Hc Group Dps - Cu66556058,1005 Silver Ave. SE,"Platinum Builders Corp., Dekker Perich Sabatini",Alterations,10016,3000000.0,"$3,000,000.00",BP-2021-22062,Commercial,Alterations,1005,SILVER,AV,SE,,1,0000,PRESBYTERIAN HOSPITAL-MAIN CAMPUS PHASE 1,10016,3000000,HC GROUP DPS - CU66556058,"PLATINUM BUILDERS CORPORATION, DEKKER PERICH SABATINI",20210831,
29,2021-08-30,"August 30, 2021",Merlyn Nyght - Cu88889025,4645 Pitt St. NE,Rader Awning & Upholstering,City Project,300,8639.0,"$8,639.00",BP-2021-06221,Commercial,City Project,4645,PITT,ST,NE,,CA,0000,FAR NE HEIGHTS SENIOR CENTER,300,8639,MERLYN NYGHT - CU88889025,RADER AWNING & UPHOLSTERING,20210830,
30,2021-08-30,"August 30, 2021",Quanz Auto Body,416 Juan Tabo Blvd. NE,Electrical Products Co.,Sign - Commercial Sign,0,1300.0,"$1,300.00",GP-2021-33985,Commercial,Sign - Commercial Sign,416,JUAN TABO,BLVD,NE,,10A,2,LA CUESTA,0,1300,QUANZ AUTO BODY,ELECTRICAL PRODUCTS COMPANY,20210830,0
31,2021-08-30,"August 30, 2021",Eric Munn - Cu61763760,1300 San Mateo Blvd. SE,"Ti Design Services, Enka Construction Llc",Addition,730,15000.0,"$15,000.00",BP-2021-35516,Commercial,Addition,1300,SAN MATEO,BLVD,SE,,1A,17,VIRGINIA PLACE ADDN,730,15000,ERIC MUNN - CU61763760,"TI DESIGN SERVICES, ENKA CONSTRUCTION LLC",20210830,1
32,2021-08-30,"August 30, 2021",Rebekah Bellum - Cu37349739,903 10Th St. SW,"Esa Construction Inc., Cherry/See/Reames Architects Pc",City Project,192,125000.0,"$125,000.00",BP-2021-24579,Commercial,City Project,903,10TH,ST,SW,,RIO GRANDE PARK & ZOO,0000,RIO GRANDE ZOO,192,125000,REBEKAH BELLUM - CU37349739,"ESA CONSTRUCTION, INC., CHERRY/SEE/REAMES ARCHITECTS PC",20210830,
33,2021-08-30,"August 30, 2021",Kenneth Myers - Cu126508399,309 Old Coors  SW,"Insight Construction, LLC",Alterations,7096,500000.0,"$500,000.00",BP-2021-18764,Commercial,Alterations,309,OLD COORS,DR,SW,,100,0000,RIO GRANDE HEIGHTS ADDN,7096,500000,KENNETH MYERS - CU126508399,"INSIGHT CONSTRUCTION, LLC",20210830,
34,2021-08-30,"August 30, 2021",Tom Gentry - Cu46431279,5001 Central Ave. NE,Landmark Construction Inc.,Addition,4613,50000.0,"$50,000.00",BP-2021-26987,Commercial,Addition,5001,CENTRAL,AV,NE,,35,39,VALLEY VIEW ADDN,4613,50000,TOM GENTRY - CU46431279,"LANDMARK CONSTRUCTION, INC.",20210830,
35,2021-08-30,"August 30, 2021",Charlie Otero - Cu104020573,2202 Menaul Blvd. NE,"Charlie M. Otero Architect Inc., Cmc Group, Llc",Alterations,7800,200000.0,"$200,000.00",BP-2021-31067,Commercial,Alterations,2202,MENAUL,BLVD,NE,,DX,0000,NETHERWOOD PARK,7800,200000,CHARLIE OTERO - CU104020573,"CHARLIE M. OTERO ARCHITECT INC, CMC GROUP, LLC",20210830,
36,2021-08-30,"August 30, 2021",Formative Architecture - Cu42313490,5400 Sevilla Ave. NW,"Aic General Contractors Inc., Formative Architecture",Alterations,1040,124186.4,"$124,186.40",BP-2021-31021,Commercial,Alterations,5400,SEVILLA,AV,NW,,K1A,0000,VISTA DE LA LUZ COMMERCIAL,1040,124186.4,FORMATIVE ARCHITECTURE - CU42313490,"AIC GENERAL CONTRACTORS, INC., FORMATIVE ARCHITECTURE",20210830,
